<?xml version="1.0" encoding="utf-8"?>
<!-- Created with Liquid Technologies Online Tools 1.0 (https://www.liquid-technologies.com) -->
<RecordingSessionPlots xsi:noNamespaceSchemaLocation="sample.xsd" FormatVersion="1.0" xmlns:xsi="http://www.w3.org/2001/XMLSchema-instance">
  <StartDate>1994-12-19</StartDate>
  <StartTime>08:19:13.30</StartTime>
  <Duration>P6Y9M2DT23H9M58.89S</Duration>
  <UniqueID>string</UniqueID>
  <PlotGroup>
    <Label>
      <DisplayText>string</DisplayText>
      <Code>string</Code>
    </Label>
    <Comment>string</Comment>
    <TimeSinceSessionStart>P0Y</TimeSinceSessionStart>
    <TimeDuration>P1Y2M27DT23H55M54.35S</TimeDuration>
    <XAxisDomain>
      <Unit>string</Unit>
      <Label>
        <DisplayText>string</DisplayText>
      </Label>
      <MinorTickInterval>-14044999999999.8</MinorTickInterval>
      <MajorTickInterval>24427200000000.2</MajorTickInterval>
      <LogScale>true</LogScale>
      <RealTime>1</RealTime>
    </XAxisDomain>
    <XYPlot>
      <Label>
        <DisplayText>string</DisplayText>
      </Label>
      <Comment>string</Comment>
      <XOffset>0</XOffset>
      <Connected>true</Connected>
      <AspectRatio>1</AspectRatio>
      <YAxisDomain>
        <Unit>string</Unit>
        <Label>
          <DisplayText>string</DisplayText>
        </Label>
        <LogScale>false</LogScale>
      </YAxisDomain>
      <XValues>
        <Scale>1</Scale>
        <Offset>0</Offset>
      </XValues>
      <YValues>
        <Scale>1</Scale>
        <Offset>0</Offset>
      </YValues>
      <PointNotation>
        <XValue>-35569399999999.8</XValue>
        <YValue>-29805999999999.8</YValue>
        <Label>
          <DisplayText>string</DisplayText>
        </Label>
      </PointNotation>
      <PointNotation>
        <XValue>-12333899999999.8</XValue>
        <YValue>-27887399999999.8</YValue>
        <Label>
          <DisplayText>string</DisplayText>
        </Label>
      </PointNotation>
      <PointNotation>
        <XValue>42647000000000.2</XValue>
        <YValue>23028000000000.2</YValue>
        <Label>
          <DisplayText>string</DisplayText>
        </Label>
      </PointNotation>
      <PointNotation>
        <XValue>-36068899999999.8</XValue>
        <YValue>34285300000000.2</YValue>
        <Label>
          <DisplayText>string</DisplayText>
        </Label>
      </PointNotation>
      <YAxisNotation>
        <BeginningValue>-28454499999999.8</BeginningValue>
        <Label>
          <DisplayText>string</DisplayText>
        </Label>
      </YAxisNotation>
      <YAxisNotation>
        <BeginningValue>23960800000000.2</BeginningValue>
        <Label>
          <DisplayText>string</DisplayText>
        </Label>
      </YAxisNotation>
      <YAxisNotation>
        <BeginningValue>-24498799999999.8</BeginningValue>
        <Label>
          <DisplayText>string</DisplayText>
        </Label>
      </YAxisNotation>
    </XYPlot>
    <XYPlot>
      <Label>
        <DisplayText>string</DisplayText>
      </Label>
      <Comment>string</Comment>
      <XOffset>0</XOffset>
      <Connected>false</Connected>
      <AspectRatio>1</AspectRatio>
      <YAxisDomain>
        <Unit>string</Unit>
        <Label>
          <DisplayText>string</DisplayText>
        </Label>
        <LogScale>0</LogScale>
      </YAxisDomain>
      <XValues>
        <Scale>1</Scale>
        <Offset>0</Offset>
      </XValues>
      <YValues>
        <Scale>1</Scale>
        <Offset>0</Offset>
      </YValues>
      <PointNotation>
        <XValue>5598500000000.24</XValue>
        <YValue>-4606799999999.76</YValue>
        <Label>
          <DisplayText>string</DisplayText>
        </Label>
      </PointNotation>
      <PointNotation>
        <XValue>2450100000000.23</XValue>
        <YValue>-35426699999999.8</YValue>
        <Label>
          <DisplayText>string</DisplayText>
        </Label>
      </PointNotation>
      <XAxisNotation>
        <BeginningValue>-1074699999999.77</BeginningValue>
        <Label>
          <DisplayText>string</DisplayText>
        </Label>
      </XAxisNotation>
      <XAxisNotation>
        <BeginningValue>28444700000000.2</BeginningValue>
        <Label>
          <DisplayText>string</DisplayText>
        </Label>
      </XAxisNotation>
      <XAxisNotation>
        <BeginningValue>-18804999999999.8</BeginningValue>
        <Label>
          <DisplayText>string</DisplayText>
        </Label>
      </XAxisNotation>
    </XYPlot>
    <XYPlot>
      <Label>
        <DisplayText>string</DisplayText>
      </Label>
      <Comment>string</Comment>
      <XOffset>0</XOffset>
      <Connected>true</Connected>
      <AspectRatio>1</AspectRatio>
      <YAxisDomain>
        <Unit>string</Unit>
        <Label>
          <DisplayText>string</DisplayText>
        </Label>
        <LogScale>true</LogScale>
      </YAxisDomain>
      <XValues>
        <Scale>1</Scale>
        <Offset>0</Offset>
      </XValues>
      <YValues>
        <Scale>1</Scale>
        <Offset>0</Offset>
      </YValues>
      <PointNotation>
        <XValue>-25248399999999.8</XValue>
        <YValue>-20669499999999.8</YValue>
        <Label>
          <DisplayText>string</DisplayText>
        </Label>
      </PointNotation>
      <PointNotation>
        <XValue>-41177499999999.8</XValue>
        <YValue>-31452799999999.8</YValue>
        <Label>
          <DisplayText>string</DisplayText>
        </Label>
      </PointNotation>
    </XYPlot>
    <XAxisNotation>
      <BeginningValue>-18235199999999.8</BeginningValue>
      <EndingValue>12493100000000.2</EndingValue>
      <Label>
        <DisplayText>string</DisplayText>
      </Label>
    </XAxisNotation>
    <XAxisNotation>
      <BeginningValue>25079500000000.2</BeginningValue>
      <Label>
        <DisplayText>string</DisplayText>
      </Label>
      <Comment>string</Comment>
    </XAxisNotation>
  </PlotGroup>
  <PlotGroup>
    <Label>
      <DisplayText>string</DisplayText>
    </Label>
    <Comment>string</Comment>
    <TimeSinceSessionStart>P0Y</TimeSinceSessionStart>
    <TimeDuration>P6Y6M14DT0H10M49.15S</TimeDuration>
    <XAxisDomain>
      <Unit>string</Unit>
      <Label>
        <DisplayText>string</DisplayText>
      </Label>
      <MinorTickInterval>43937200000000.2</MinorTickInterval>
      <MajorTickInterval>-6532399999999.76</MajorTickInterval>
      <LogScale>1</LogScale>
      <RealTime>0</RealTime>
    </XAxisDomain>
    <XYPlot>
      <Label>
        <DisplayText>string</DisplayText>
      </Label>
      <Comment>string</Comment>
      <XOffset>0</XOffset>
      <Connected>true</Connected>
      <AspectRatio>1</AspectRatio>
      <YAxisDomain>
        <Unit>string</Unit>
        <Label>
          <DisplayText>string</DisplayText>
        </Label>
        <LogScale>1</LogScale>
      </YAxisDomain>
      <XValues>
        <Scale>1</Scale>
        <Offset>0</Offset>
      </XValues>
      <YValues>
        <Scale>1</Scale>
        <Offset>0</Offset>
      </YValues>
      <PointNotation>
        <XValue>36655600000000.2</XValue>
        <YValue>27446000000000.2</YValue>
        <Label>
          <DisplayText>string</DisplayText>
        </Label>
      </PointNotation>
      <PointNotation>
        <XValue>-3148899999999.77</XValue>
        <YValue>37871200000000.2</YValue>
        <Label>
          <DisplayText>string</DisplayText>
        </Label>
      </PointNotation>
      <XAxisNotation>
        <BeginningValue>-38499899999999.8</BeginningValue>
        <Label>
          <DisplayText>string</DisplayText>
        </Label>
      </XAxisNotation>
      <XAxisNotation>
        <BeginningValue>-49546299999999.8</BeginningValue>
        <Label>
          <DisplayText>string</DisplayText>
        </Label>
      </XAxisNotation>
      <XAxisNotation>
        <BeginningValue>49628700000000.2</BeginningValue>
        <Label>
          <DisplayText>string</DisplayText>
        </Label>
      </XAxisNotation>
      <XAxisNotation>
        <BeginningValue>977000000000.235</BeginningValue>
        <Label>
          <DisplayText>string</DisplayText>
        </Label>
      </XAxisNotation>
      <YAxisNotation>
        <BeginningValue>3036500000000.23</BeginningValue>
        <Label>
          <DisplayText>string</DisplayText>
        </Label>
      </YAxisNotation>
      <YAxisNotation>
        <BeginningValue>20332300000000.2</BeginningValue>
        <Label>
          <DisplayText>string</DisplayText>
        </Label>
      </YAxisNotation>
      <YAxisNotation>
        <BeginningValue>23879000000000.2</BeginningValue>
        <Label>
          <DisplayText>string</DisplayText>
        </Label>
      </YAxisNotation>
    </XYPlot>
    <XYPlot>
      <Label>
        <DisplayText>string</DisplayText>
      </Label>
      <Comment>string</Comment>
      <XOffset>0</XOffset>
      <Connected>1</Connected>
      <AspectRatio>1</AspectRatio>
      <YAxisDomain>
        <Unit>string</Unit>
        <Label>
          <DisplayText>string</DisplayText>
        </Label>
        <LogScale>false</LogScale>
      </YAxisDomain>
      <XValues>
        <Scale>1</Scale>
        <Offset>0</Offset>
      </XValues>
      <YValues>
        <Scale>1</Scale>
        <Offset>0</Offset>
      </YValues>
      <XAxisNotation>
        <BeginningValue>9745000000000.23</BeginningValue>
        <Label>
          <DisplayText>string</DisplayText>
        </Label>
      </XAxisNotation>
      <XAxisNotation>
        <BeginningValue>20621500000000.2</BeginningValue>
        <Label>
          <DisplayText>string</DisplayText>
        </Label>
      </XAxisNotation>
      <XAxisNotation>
        <BeginningValue>9914000000000.23</BeginningValue>
        <Label>
          <DisplayText>string</DisplayText>
        </Label>
      </XAxisNotation>
      <YAxisNotation>
        <BeginningValue>-46087099999999.8</BeginningValue>
        <Label>
          <DisplayText>string</DisplayText>
        </Label>
      </YAxisNotation>
      <YAxisNotation>